{
  "schema_version": "0.1",
  "context_ledger_id": "cl-batch-a-context-v1",
  "project_id": "devframe-system",
  "goal_id": "goal-runtime-governance-batch-a",
  "task_id": "task-context-contracts",
  "created_at": "2026-07-07T00:00:00Z",
  "append_only": true,
  "entries": [
    {
      "ledger_entry_id": "cle-batch-a-context-created",
      "entry_index": 0,
      "previous_entry_hash": null,
      "entry_hash": "sha256:5555555555555555555555555555555555555555555555555555555555555555",
      "occurred_at": "2026-07-07T00:00:00Z",
      "actor_id": "main-coordinator",
      "actor_role": "coordinator",
      "event_type": "packet_created",
      "context_packet_id": "cp-batch-a-context-v1",
      "summary": "Created a sealed context packet from explicit public planning sources.",
      "source_refs": [
        {
          "ref_id": "runtime-plan",
          "kind": "file",
          "uri": "PLAN.md",
          "content_hash": "sha256:2222222222222222222222222222222222222222222222222222222222222222"
        }
      ],
      "domain_refs": {
        "batch": "runtime-governance-batch-a"
      }
    },
    {
      "ledger_entry_id": "cle-batch-a-context-dispatched",
      "entry_index": 1,
      "previous_entry_hash": "sha256:5555555555555555555555555555555555555555555555555555555555555555",
      "entry_hash": "sha256:7777777777777777777777777777777777777777777777777777777777777777",
      "occurred_at": "2026-07-07T00:10:00Z",
      "actor_id": "main-coordinator",
      "actor_role": "coordinator",
      "event_type": "packet_dispatched",
      "context_packet_id": "cp-batch-a-context-v1",
      "summary": "Dispatched packet for read-only schema review."
    }
  ]
}
